slug,titulo,descripcion_corta,descripcion_larga
mariposario,"El Mariposario: Santuario de Colores","Un espacio mágico dedicado a la conservación y estudio de los lepidópteros de nuestra región.","Sumérgete en un ecosistema vibrante donde la ciencia y la belleza natural se encuentran. Nuestro mariposario es un laboratorio vivo diseñado para el estudio del ciclo de vida, comportamiento y rol ecológico de diversas especies de mariposas autóctonas..."
zorro,"Refugio del Zorro Diego","Conoce a Diego, el zorro rescatado que se ha convertido en el embajador de nuestra fauna silvestre.","Diego no es solo un residente del jardín; es un símbolo de conservación y respeto por la vida silvestre. Este ejemplar de zorro fue rescatado y, debido a sus condiciones, encontró en nuestras instalaciones un hogar permanente..."
morrocoyes,"Santuario de Morrocoyes","Un espacio de paz para observar a estos antiguos reptiles y aprender sobre su longevidad.","Un viaje a un ritmo más lento. La zona de morrocoyes alberga a varios ejemplares de esta icónica especie de tortuga terrestre. Este espacio amplio y soleado recrea el sotobosque tropical..."
cuyos,"Granja de Contacto: Cuyos y Conejos","Un área interactiva y educativa diseñada para el aprendizaje práctico sobre pequeños mamíferos.","Diseñada especialmente para despertar la empatía y la responsabilidad en los más jóvenes, esta zona de contacto permite una interacción segura y supervisada con nuestros dóciles cuyos y conejos..."
museo,"Museo de Entomología","Explora el fascinante y microscópico mundo de los insectos en nuestra colección académica.","Detrás de cada hoja y bajo cada roca del jardín, existe un universo complejo que sostiene nuestro ecosistema. El Museo de Entomología alberga una invaluable colección científica de insectos disecados y preservados..."
lombricultivo,"Estación de Lombricultura y Compostaje","El corazón de nuestro sistema de reciclaje orgánico, donde la naturaleza transforma los residuos en vida.","La sostenibilidad es un pilar fundamental de nuestras instalaciones. En la estación de lombricultura, demostramos en tiempo real cómo la biotecnología natural puede resolver problemas ambientales utilizando la lombriz roja californiana..."